N27217	news	newsus	'Brunch bills' enjoy wide support around Atlanta in Election Day voting, but fail in one city	The people of metro Atlanta have spoken, and they have spoken (nearly) in unison: They want boozy brunches. There was, however, at least one exception. Out of 17 communities where 11Alive tracked results from Tuesday's voting, at least 15 were...	https://www.msn.com/en-us/news/newsus/'brunch-bills'-enjoy-wide-support-around-atlanta-in-election-day-voting,-but-fail-in-one-city/ar-AAJWFOr?ocid=chopendata	[{"Label": "Atlanta, Indiana", "Type": "G", "WikidataId": "Q2598396", "Confidence": 1.0, "OccurrenceOffsets": [41], "SurfaceForms": ["Atlanta"]}, {"Label": "Indiana", "Type": "G", "WikidataId": "Q1415", "Confidence": 0.977, "OccurrenceOffsets": [49], "SurfaceForms": ["in"]}]	[{"Label": "WXIA-TV", "Type": "M", "WikidataId": "Q7957641", "Confidence": 1.0, "OccurrenceOffsets": [180], "SurfaceForms": ["11Alive"]}, {"Label": "Atlanta", "Type": "G", "WikidataId": "Q23556", "Confidence": 1.0, "OccurrenceOffsets": [20], "SurfaceForms": ["Atlanta"]}]
N24080	entertainment	celebrity	Week in celebrity photos for Oct. 7-11, 2019	Week in celebrity photos for Oct. 7-11, 2019	https://www.msn.com/en-us/entertainment/celebrity/week-in-celebrity-photos-for-oct.-7-11,-2019/ss-AAIpBUI?ocid=chopendata	[]	[]
N23676	sports	football_ncaa	3 takeaways from Oklahoma's win over Texas in Red River Showdown	The Sooners used a strong defensive performance and a career day from CeeDee Lamb to remain undefeated.	https://www.msn.com/en-us/sports/football_ncaa/3-takeaways-from-oklahoma's-win-over-texas-in-red-river-showdown/ar-AAIGxv9?ocid=chopendata	[{"Label": "Texas", "Type": "G", "WikidataId": "Q1439", "Confidence": 0.912, "OccurrenceOffsets": [37], "SurfaceForms": ["Texas"]}, {"Label": "Red River Showdown", "Type": "U", "WikidataId": "Q7304859", "Confidence": 1.0, "OccurrenceOffsets": [46], "SurfaceForms": ["Red River Showdown"]}]	[{"Label": "Oklahoma Sooners football", "Type": "F", "WikidataId": "Q10608114", "Confidence": 0.998, "OccurrenceOffsets": [4], "SurfaceForms": ["Sooners"]}, {"Label": "CeeDee Lamb", "Type": "N", "WikidataId": "Q57313601", "Confidence": 1.0, "OccurrenceOffsets": [70], "SurfaceForms": ["CeeDee Lamb"]}]
N21697	news	newsus	Iowa woman killed by explosion at gender reveal party	An Iowa woman was killed by debris from an explosion at a gender reveal party on Saturday, police said.	https://www.msn.com/en-us/news/newsus/iowa-woman-killed-by-explosion-at-gender-reveal-party/ar-AAJrGoa?ocid=chopendata	[{"Label": "Iowa", "Type": "G", "WikidataId": "Q1546", "Confidence": 0.983, "OccurrenceOffsets": [0], "SurfaceForms": ["Iowa"]}]	[{"Label": "Iowa", "Type": "G", "WikidataId": "Q1546", "Confidence": 0.983, "OccurrenceOffsets": [3], "SurfaceForms": ["Iowa"]}]
N21021	sports	baseball_mlb	Washington Nationals Pitcher Joins Long Line of Champion Athletes Turning Down White House Visit	"At the end of the day, as much as I wanted to be there with my teammates and share that experience with my teammates, I can't do it. I just can't do it," Nats closer Sean Doolittle told The Washington Post.	https://www.msn.com/en-us/sports/baseball_mlb/washington-nationals-pitcher-joins-long-line-of-champion-athletes-turning-down-white-house-visit/ar-AAJJcKb?ocid=chopendata	[{"Label": "White House", "Type": "F", "WikidataId": "Q35525", "Confidence": 0.998, "OccurrenceOffsets": [79], "SurfaceForms": ["White House"]}, {"Label": "Washington Nationals", "Type": "O", "WikidataId": "Q825838", "Confidence": 0.997, "OccurrenceOffsets": [0], "SurfaceForms": ["Washington Nationals"]}]	[{"Label": "Sean Doolittle", "Type": "P", "WikidataId": "Q959451", "Confidence": 1.0, "OccurrenceOffsets": [167], "SurfaceForms": ["Sean Doolittle"]}, {"Label": "Washington Nationals", "Type": "O", "WikidataId": "Q825838", "Confidence": 0.997, "OccurrenceOffsets": [155], "SurfaceForms": ["Nats"]}, {"Label": "The Washington Post", "Type": "M", "WikidataId": "Q166032", "Confidence": 1.0, "OccurrenceOffsets": [187], "SurfaceForms": ["The Washington Post"]}]
N26028	health	weightloss	'I would always crave my next meal': 360LB woman who used to eat until she couldn't BREATHE looks almost unrecognizable after overhauling her diet and losing nearly 200LBS	Adrianna Stye went from 363 pounds to 170 pounds after struggling with her unhealthy diet all her life.	https://www.msn.com/en-us/health/weightloss/i-would-always-crave-my-next-meal-360lb-woman-who-used-to-eat-until-she-couldnt-breathe-looks-almost-unrecognizable-after-overhauling-her-diet-and-losing-nearly-200lbs/ar-AAHcDUi?ocid=chopendata	[]	[]
N1583	sports	racing	Power Rankings: Round of 8 opens with a bang, Texas on tap	NASCAR.com's Pat DeCola ranks the eight remaining NASCAR Playoffs drivers after the race at Martinsville Speedway and ahead of the race at Texas.	https://www.msn.com/en-us/sports/racing/power-rankings-round-of-8-opens-with-a-bang-texas-on-tap/ss-AAJwhEk?ocid=chopendata	[{"Label": "Texas", "Type": "G", "WikidataId": "Q1439", "Confidence": 0.98, "OccurrenceOffsets": [46], "SurfaceForms": ["Texas"]}, {"Label": "Sports rating system", "Type": "C", "WikidataId": "Q7579939", "Confidence": 1.0, "OccurrenceOffsets": [0], "SurfaceForms": ["Power Rankings"]}]	[{"Label": "Martinsville Speedway", "Type": "U", "WikidataId": "Q1815381", "Confidence": 1.0, "OccurrenceOffsets": [92], "SurfaceForms": ["Martinsville Speedway"]}, {"Label": "Texas", "Type": "G", "WikidataId": "Q1439", "Confidence": 0.98, "OccurrenceOffsets": [139], "SurfaceForms": ["Texas"]}, {"Label": "NASCAR playoffs", "Type": "U", "WikidataId": "Q1068013", "Confidence": 1.0, "OccurrenceOffsets": [50], "SurfaceForms": ["NASCAR Playoffs"]}, {"Label": "Pat DeCola", "Type": "P", "WikidataId": "Q7143356", "Confidence": 1.0, "OccurrenceOffsets": [13], "SurfaceForms": ["Pat DeCola"]}, {"Label": "NASCAR", "Type": "U", "WikidataId": "Q233929", "Confidence": 1.0, "OccurrenceOffsets": [0], "SurfaceForms": ["NASCAR.com"]}]
N7136	lifestyle	lifestylehomeandgarden	These Are the Hottest Paint Colors Right Now, According to Google	Beyond avoiding lead paint at all costs, and figuring out what is chalk paint, picking paint colors is relatively straight-forward, though it does take a good bit of research. You can always go to your local paint or hardware store to ask for a little guidance, or you can take the easiest route and turn to Google, like many, many other people do.	https://www.msn.com/en-us/lifestyle/lifestylehomeandgarden/these-are-the-hottest-paint-colors-right-now,-according-to-google/ar-AACocXl?ocid=chopendata	[{"Label": "Google", "Type": "O", "WikidataId": "Q95", "Confidence": 0.992, "OccurrenceOffsets": [59], "SurfaceForms": ["Google"]}, {"Label": "Temperature", "Type": "C", "WikidataId": "Q11466", "Confidence": 1.0, "OccurrenceOffsets": [14], "SurfaceForms": ["Hottest"]}]	[{"Label": "Google", "Type": "O", "WikidataId": "Q95", "Confidence": 0.992, "OccurrenceOffsets": [308], "SurfaceForms": ["Google"]}]
N19443	travel	traveltripideas	13 Famous Movie Landmarks You Can See in L.A.		https://www.msn.com/en-us/travel/traveltripideas/13-famous-movie-landmarks-you-can-see-in-l-a/ss-AAI4El3?ocid=chopendata	[{"Label": "Los Angeles", "Type": "G", "WikidataId": "Q65", "Confidence": 1.0, "OccurrenceOffsets": [41], "SurfaceForms": ["L.A."]}]	[]
N27820	sports	baseball_mlb	Nationals rode their rotation to World Series title	Patrick Corbin, Anibal Sanchez, Max Scherzer, and Stephen Strasburg accounted for 107 2/3 innings in the postseason.	https://www.msn.com/en-us/sports/baseball_mlb/nationals-rode-their-rotation-to-world-series-title/ar-AAJJcMV?ocid=chopendata	[{"Label": "Washington Nationals", "Type": "O", "WikidataId": "Q825838", "Confidence": 1.0, "OccurrenceOffsets": [0], "SurfaceForms": ["Nationals"]}, {"Label": "World Series", "Type": "E", "WikidataId": "Q265538", "Confidence": 0.954, "OccurrenceOffsets": [33], "SurfaceForms": ["World Series"]}]	[{"Label": "Stephen Strasburg", "Type": "P", "WikidataId": "Q1192310", "Confidence": 1.0, "OccurrenceOffsets": [50], "SurfaceForms": ["Stephen Strasburg"]}, {"Label": "An\u00edbal S\u00e1nchez", "Type": "P", "WikidataId": "Q936661", "Confidence": 1.0, "OccurrenceOffsets": [16], "SurfaceForms": ["Anibal Sanchez"]}, {"Label": "Patrick Corbin", "Type": "P", "WikidataId": "Q3369361", "Confidence": 1.0, "OccurrenceOffsets": [0], "SurfaceForms": ["Patrick Corbin"]}, {"Label": "Max Scherzer", "Type": "P", "WikidataId": "Q3028907", "Confidence": 1.0, "OccurrenceOffsets": [32], "SurfaceForms": ["Max Scherzer"]}]
N21658	sports	basketball_ncaa	Couch: Getting 'exposed' at the Champions Classic is part of MSU's Final Four process	Tom Izzo hates losing in the Champions Classic, but history shows it has little bearing on the season ahead, March especially	https://www.msn.com/en-us/sports/ncaabk/couch-getting-exposed-at-the-champions-classic-is-part-of-msus-final-four-process/ar-AAJWFUF?ocid=chopendata	[{"Label": "Champions Classic", "Type": "U", "WikidataId": "Q5070058", "Confidence": 1.0, "OccurrenceOffsets": [32], "SurfaceForms": ["Champions Classic"]}]	[{"Label": "Champions Classic", "Type": "U", "WikidataId": "Q5070058", "Confidence": 1.0, "OccurrenceOffsets": [29], "SurfaceForms": ["Champions Classic"]}, {"Label": "Tom Izzo", "Type": "P", "WikidataId": "Q3992490", "Confidence": 1.0, "OccurrenceOffsets": [0], "SurfaceForms": ["Tom Izzo"]}]
N26373	autos	autosnews	Genesis EV Crossover Test Mule Spied Wearing Kia's Clothes	If it's not a test mule, then this crazy Niro needs a Rocket Bunny makeover stat.	https://www.msn.com/en-us/autos/autosnews/genesis-ev-crossover-test-mule-spied-wearing-kia's-clothes/ar-AAGmGXF?ocid=chopendata	[{"Label": "Electric car", "Type": "C", "WikidataId": "Q193692", "Confidence": 0.939, "OccurrenceOffsets": [8], "SurfaceForms": ["EV"]}]	[]
N13891	health	health-news	Alzhemier's risk may be 75% higher for people who eat trans fats	The trans fats still hidden in many foods increased the risk of Alzheimer's and other types of dementia by up to 75%, according to a long-term study.	https://www.msn.com/en-us/health/health-news/alzhemiers-risk-may-be-75-higher-for-people-who-eat-trans-fats/ar-AAJfUpB?ocid=chopendata	[]	[{"Label": "Alzheimer's disease", "Type": "U", "WikidataId": "Q11081", "Confidence": 0.993, "OccurrenceOffsets": [64], "SurfaceForms": ["Alzheimer's"]}]
N11730	finance	finance-real-estate	That super low mortgage rate? It could be even lower	The gap between Treasury yields and mortgage rates is higher than it has been in years as borrowers' appetite outpaces availability and as investors demand higher returns on mortgage-backed securities.	https://www.msn.com/en-us/finance/finance-real-estate/that-super-low-mortgage-rate?-it-could-be-even-lower/ar-AAIzy3L?ocid=chopendata	[]	[]
N20647	health	nutrition	9 Vegetables You Shouldn't Eat Raw	Are raw foods healthier than cooked foods?	https://www.msn.com/en-us/health/nutrition/9-vegetables-you-shouldn't-eat-raw/ss-AACMPka?ocid=chopendata	[]	[]
N8737	foodanddrink	restaurantsandnews	Customers Are Trolling Papa John's Over Their Jack-O'-Lantern Pizzas	This is truly scary.	https://www.msn.com/en-us/foodanddrink/restaurantsandnews/customers-are-trolling-papa-john's-over-their-jack-o'-lantern-pizzas/ar-AAJwqWG?ocid=chopendata	[{"Label": "Papa John's Pizza", "Type": "O", "WikidataId": "Q2759586", "Confidence": 1.0, "OccurrenceOffsets": [23], "SurfaceForms": ["Papa John's"]}]	[]
N4633	sports	baseball_mlb	MLB playoffs: Nationals' Howie Kendrick keeps playing postseason hero	Washington's veteran infielder has come through with some of the biggest hits in the team's thrilling postseason run.	https://www.msn.com/en-us/sports/mlb/mlb-playoffs-nationals-howie-kendrick-keeps-playing-postseason-hero/ar-AAINwKL?ocid=chopendata	[{"Label": "Howie Kendrick", "Type": "P", "WikidataId": "Q861206", "Confidence": 1.0, "OccurrenceOffsets": [25], "SurfaceForms": ["Howie Kendrick"]}, {"Label": "Washington Nationals", "Type": "O", "WikidataId": "Q825838", "Confidence": 0.999, "OccurrenceOffsets": [14], "SurfaceForms": ["Nationals"]}, {"Label": "Major League Baseball", "Type": "O", "WikidataId": "Q1163715", "Confidence": 0.998, "OccurrenceOffsets": [0], "SurfaceForms": ["MLB"]}]	[{"Label": "Washington Nationals", "Type": "O", "WikidataId": "Q825838", "Confidence": 0.999, "OccurrenceOffsets": [0], "SurfaceForms": ["Washington"]}]
N19279	news	newscrime	Teens tried as adults after 6-foot log pushed off a cliff, killing woman at Ohio state park	Victoria Schafer was killed near Old Man's Cave in Hocking Hills State Park on Labor Day. Both suspects are being held at $100,000 bond.	https://www.msn.com/en-us/news/newscrime/teens-tried-as-adults-after-6-foot-log-pushed-off-a-cliff,-killing-woman-at-ohio-state-park/ar-AAJWFYk?ocid=chopendata	[]	[{"Label": "Labor Day", "Type": "H", "WikidataId": "Q848352", "Confidence": 0.979, "OccurrenceOffsets": [79], "SurfaceForms": ["Labor Day"]}, {"Label": "Hocking Hills State Park", "Type": "L", "WikidataId": "Q5875771", "Confidence": 1.0, "OccurrenceOffsets": [51], "SurfaceForms": ["Hocking Hills State Park"]}]
N15667	travel	traveltripideas	From Grand Gothic Cathedrals to Gorgeous Neoclassical Chapels: The 10 Best Churches in Paris	Experience the city's history through its most stunning buildings.	https://www.msn.com/en-us/travel/traveltripideas/from-grand-gothic-cathedrals-to-gorgeous-neoclassical-chapels-the-10-best-churches-in-paris/ss-AAI4Gn9?ocid=chopendata	[{"Label": "Gothic architecture", "Type": "U", "WikidataId": "Q176483", "Confidence": 1.0, "OccurrenceOffsets": [11], "SurfaceForms": ["Gothic Cathedrals"]}]	[]
N16559	sports	football_nfl	Kyle Shanahan gave dad Mike game ball after win over Washington	Following the game, the younger Shanahan trolled the Skins in epic fashion. The Shanahans were fired by Washington following the 2013 season.	https://www.msn.com/en-us/sports/football_nfl/kyle-shanahan-gave-dad-mike-game-ball-after-win-over-washington/ar-AAJ4OUU?ocid=chopendata	[{"Label": "Kyle Shanahan", "Type": "P", "WikidataId": "Q6451434", "Confidence": 1.0, "OccurrenceOffsets": [0], "SurfaceForms": ["Kyle Shanahan"]}, {"Label": "Mike Shanahan", "Type": "P", "WikidataId": "Q1857407", "Confidence": 0.996, "OccurrenceOffsets": [23], "SurfaceForms": ["Mike"]}]	[{"Label": "Kyle Shanahan", "Type": "P", "WikidataId": "Q6451434", "Confidence": 1.0, "OccurrenceOffsets": [32, 80], "SurfaceForms": ["Shanahan", "Shanahans"]}]
N13912	lifestyle	lifestylefamilyandrelationships	27 ways having grandchildren changes your life	[node:summary] Here are 27 ways, for better and for worse, that your life will change when you have grandchildren.	https://www.msn.com/en-us/lifestyle/lifestylefamilyandrelationships/27-ways-having-grandchildren-changes-your-life/ss-AACMf1T?ocid=chopendata	[]	[]
N7443	health	voices	For 6 Years, Doctors Kept Telling Me I Had PMS but It Turned Out to Be Brain Cancer	Karissa Ostheimer, 34, regularly experienced brief yet terrifying episodes that left her frozen and unable to speak. But only when she had one behind the wheel and crashed her car did doctors consider they could be related to something far more serious than her period.	https://www.msn.com/en-us/health/voices/for-6-years,-doctors-kept-telling-me-i-had-pms-but-it-turned-out-to-be-brain-cancer/ar-AAF8OqA?ocid=chopendata	[{"Label": "Brain tumor", "Type": "C", "WikidataId": "Q233309", "Confidence": 0.927, "OccurrenceOffsets": [71], "SurfaceForms": ["Brain Cancer"]}]	[]
N11290	lifestyle	lifestylehomeandgarden	50 Things You Should Know About Your Home	Read up about handy home maintenance tips.	https://www.msn.com/en-us/lifestyle/lifestylehomeandgarden/50-things-you-should-know-about-your-home/ss-AAHg627?ocid=chopendata	[{"Label": "Your Home", "Type": "U", "WikidataId": "Q17060160", "Confidence": 1.0, "OccurrenceOffsets": [32], "SurfaceForms": ["Your Home"]}]	[]
N25990	travel	travelnews	Disney apologizes to guests after Skyliner 'nightmare;' no indication on reopening	Walt Disney World has yet to set a reopening date for its new aerial cable car system, the Skyliner, after it stranded passengers for hours	https://www.msn.com/en-us/travel/travelnews/disney-apologizes-to-guests-after-skyliner-'nightmare;'-no-indication-on-reopening/ar-AAIpBu5?ocid=chopendata	[{"Label": "The Walt Disney Company", "Type": "O", "WikidataId": "Q7414", "Confidence": 0.953, "OccurrenceOffsets": [0], "SurfaceForms": ["Disney"]}, {"Label": "Disney Skyliner", "Type": "U", "WikidataId": "Q39046747", "Confidence": 1.0, "OccurrenceOffsets": [34], "SurfaceForms": ["Skyliner"]}]	[{"Label": "Disney Skyliner", "Type": "U", "WikidataId": "Q39046747", "Confidence": 1.0, "OccurrenceOffsets": [91], "SurfaceForms": ["Skyliner"]}, {"Label": "Walt Disney World", "Type": "O", "WikidataId": "Q206859", "Confidence": 1.0, "OccurrenceOffsets": [0], "SurfaceForms": ["Walt Disney World"]}]
N1722	foodanddrink	restaurantsandnews	This fast food chain has the best fries, according to customers	We asked our readers who has the best fries in all of fast food, and Five Guys' fries snatched the potato cake right from McDonald's greasy grasp.	https://www.msn.com/en-us/foodanddrink/restaurantsandnews/this-fast-food-chain-has-the-best-fries,-according-to-customers/ss-AAJaD1A?ocid=chopendata	[]	[{"Label": "McDonald's", "Type": "O", "WikidataId": "Q38076", "Confidence": 1.0, "OccurrenceOffsets": [122], "SurfaceForms": ["McDonald's"]}]
N27285	health	nutrition	6 Signs You're Not Getting Enough Potassium	Potassium is a crucial electrolyte that helps your muscles, but if your levels are too low, you could be in trouble. If you match many of these signs, you might want to ask your doctor about a potassium deficiency. Better safe than sorry! The post 6 Signs You're Not Getting Enough Potassium appeared first on The Healthy.	https://www.msn.com/en-us/health/nutrition/6-signs-you're-not-getting-enough-potassium/ss-AAHu3bc?ocid=chopendata	[]	[{"Label": "Health", "Type": "C", "WikidataId": "Q12147", "Confidence": 1.0, "OccurrenceOffsets": [310], "SurfaceForms": ["The Healthy"]}]
N21337	health	wellness	These are the unhealthiest zip codes in Dallas County	A new report from the Parkland Health and Hospital System has revealed some stark facts about how your quality of health is tied to where you live. The report found that African Americans who live in the southern part of Dallas are the most likely people in the county to be unhealthy. It also found that group of people has the least access to care. The above graphic shows a map of the different zip codes in the county with each's overall health...	https://www.msn.com/en-us/health/wellness/these-are-the-unhealthiest-zip-codes-in-dallas-county/ar-AAJl5mM?ocid=chopendata	[{"Label": "Dallas County, Texas", "Type": "G", "WikidataId": "Q111168", "Confidence": 0.998, "OccurrenceOffsets": [40], "SurfaceForms": ["Dallas County"]}]	[{"Label": "Dallas County, Texas", "Type": "G", "WikidataId": "Q111168", "Confidence": 0.998, "OccurrenceOffsets": [221], "SurfaceForms": ["Dallas"]}, {"Label": "Parkland Health & Hospital System", "Type": "U", "WikidataId": "Q7138568", "Confidence": 1.0, "OccurrenceOffsets": [22], "SurfaceForms": ["Parkland Health and Hospital System"]}, {"Label": "African Americans", "Type": "Y", "WikidataId": "Q49085", "Confidence": 0.998, "OccurrenceOffsets": [170], "SurfaceForms": ["African Americans"]}]
N8411	lifestyle	lifestyledidyouknow	25 Optical Illusions That Will Make Your Brain Hurt	From spinning circles to disappearing dots, these insane optical illusions aren't what they appear to be. Are you ready to have your mind blown? The post 25 Optical Illusions That Will Make Your Brain Hurt appeared first on Reader's Digest.	https://www.msn.com/en-us/lifestyle/lifestyledidyouknow/25-optical-illusions-that-will-make-your-brain-hurt/ss-AAHAIO8?ocid=chopendata	[{"Label": "Optical illusion", "Type": "C", "WikidataId": "Q174923", "Confidence": 0.995, "OccurrenceOffsets": [3], "SurfaceForms": ["Optical Illusions"]}]	[{"Label": "Optical illusion", "Type": "C", "WikidataId": "Q174923", "Confidence": 0.995, "OccurrenceOffsets": [57, 157], "SurfaceForms": ["optical illusions", "Optical Illusions"]}, {"Label": "Reader's Digest", "Type": "M", "WikidataId": "Q371820", "Confidence": 0.998, "OccurrenceOffsets": [224], "SurfaceForms": ["Reader's Digest"]}]
N14185	lifestyle	lifestyleroyals	Prince Harry Has the Sweetest Response When Young Student Calls Him Handsome During Japan Trip	Prince Harry Has Sweet Response When Student Calls Him Handsome	https://www.msn.com/en-us/lifestyle/lifestyleroyals/prince-harry-has-the-sweetest-response-when-young-student-calls-him-handsome-during-japan-trip/ar-AAJKO3h?ocid=chopendata	[{"Label": "Prince Harry, Duke of Sussex", "Type": "N", "WikidataId": "Q152316", "Confidence": 1.0, "OccurrenceOffsets": [0], "SurfaceForms": ["Prince Harry"]}, {"Label": "Handsome (song)", "Type": "W", "WikidataId": "Q19263662", "Confidence": 0.981, "OccurrenceOffsets": [68], "SurfaceForms": ["Handsome"]}]	[{"Label": "Prince Harry, Duke of Sussex", "Type": "N", "WikidataId": "Q152316", "Confidence": 1.0, "OccurrenceOffsets": [0], "SurfaceForms": ["Prince Harry"]}, {"Label": "Handsome (song)", "Type": "W", "WikidataId": "Q19263662", "Confidence": 0.981, "OccurrenceOffsets": [55], "SurfaceForms": ["Handsome"]}]
N26608	news	newsfactcheck	Fact-checking Trump's spin about the 'great' outcome in Syria	The president glossed over uncomfortable facts and pitched fake ones as he declared victory in Syria	https://www.msn.com/en-us/news/newsfactcheck/fact-checking-trump's-spin-about-the-'great'-outcome-in-syria/ar-AAJgU6g?ocid=chopendata	[{"Label": "Donald Trump", "Type": "P", "WikidataId": "Q22686", "Confidence": 1.0, "OccurrenceOffsets": [14], "SurfaceForms": ["Trump"]}, {"Label": "Fact-checking", "Type": "N", "WikidataId": "Q59555084", "Confidence": 1.0, "OccurrenceOffsets": [0], "SurfaceForms": ["Fact-checking"]}, {"Label": "Syria", "Type": "G", "WikidataId": "Q858", "Confidence": 0.995, "OccurrenceOffsets": [56], "SurfaceForms": ["Syria"]}]	[{"Label": "Syria", "Type": "G", "WikidataId": "Q858", "Confidence": 0.995, "OccurrenceOffsets": [95], "SurfaceForms": ["Syria"]}]
N7675	weather	weathertopstories	4Warn Forecast: Showers moving out, chilly for the Cardinals game tonight!	This Afternoon: 40s. Rain moving east and ending early. Breezy and chilly. The temperature will hover in the upper mid-40s. Wind: WNW 15-25 mph This Evening: Low 40s. Clearing skies and chilly! Wind: W 8-12 mph Tonight: 38. Clear skies. Near freezing in outlying areas. There should be enough wind in most areas to prevent frost. Wind: W 5-8 mph Saturday: 62. Sunny. Normal high is 70. Wind: SW 10-15 mph Sunday: Low 45/High 67. A chilly start then...	https://www.msn.com/en-us/weather/topstories/4warn-forecast-showers-moving-out-chilly-for-the-cardinals-game-tonight/ar-AACN1z5?ocid=chopendata	[]	[{"Label": "Points of the compass", "Type": "C", "WikidataId": "Q11114344", "Confidence": 0.943, "OccurrenceOffsets": [130, 392], "SurfaceForms": ["WNW", "SW"]}, {"Label": "Eukaryotic small ribosomal subunit (40S)", "Type": "U", "WikidataId": "Q4637383", "Confidence": 0.911, "OccurrenceOffsets": [16, 162], "SurfaceForms": ["40s", "40s"]}, {"Label": "Breezy", "Type": "W", "WikidataId": "Q653251", "Confidence": 0.993, "OccurrenceOffsets": [56], "SurfaceForms": ["Breezy"]}]
N24282	news	newsworld	Erdogan: Turkey arrested slain ISIS leader Baghdadi's wife, other relatives	Turkey's president on Wednesday announced the country's forces had captured multiple relatives of slain ISIS leader Abu Bakr al-Baghdadi, including one of the terrorist's wives -- but he also used the occasion to needle the United States for making "a fuss" about the mission that resulted in the most-wanted militant's death.	https://www.msn.com/en-us/news/world/erdogan-turkey-arrested-slain-isis-leader-baghdadis-wife-other-relatives/ar-AAJWFpZ?ocid=chopendata	[{"Label": "Recep Tayyip Erdo\u011fan", "Type": "P", "WikidataId": "Q39259", "Confidence": 1.0, "OccurrenceOffsets": [0], "SurfaceForms": ["Erdogan"]}, {"Label": "Islamic State of Iraq and the Levant", "Type": "U", "WikidataId": "Q2429253", "Confidence": 1.0, "OccurrenceOffsets": [31], "SurfaceForms": ["ISIS"]}, {"Label": "Turkey", "Type": "G", "WikidataId": "Q43", "Confidence": 0.992, "OccurrenceOffsets": [9], "SurfaceForms": ["Turkey"]}]	[{"Label": "President of Turkey", "Type": "K", "WikidataId": "Q1922067", "Confidence": 1.0, "OccurrenceOffsets": [0], "SurfaceForms": ["Turkey's president"]}, {"Label": "Islamic State of Iraq and the Levant", "Type": "U", "WikidataId": "Q2429253", "Confidence": 1.0, "OccurrenceOffsets": [104], "SurfaceForms": ["ISIS"]}, {"Label": "United States", "Type": "G", "WikidataId": "Q30", "Confidence": 0.989, "OccurrenceOffsets": [224], "SurfaceForms": ["United States"]}]
N15633	foodanddrink	recipes	Pizza Hut Is Testing Out Round Pizza Boxes That Can Keep Your Pizza Safer (And Hotter!) During Delivery	Why are they square again?	https://www.msn.com/en-us/foodanddrink/recipes/pizza-hut-is-testing-out-round-pizza-boxes-that-can-keep-your-pizza-safer-(and-hotter!)-during-delivery/ar-AAJaD2l?ocid=chopendata	[{"Label": "Pizza Hut", "Type": "O", "WikidataId": "Q191615", "Confidence": 0.999, "OccurrenceOffsets": [0], "SurfaceForms": ["Pizza Hut"]}]	[]
