N10063	tv	tv-celebrity	Ellie Kemper announces birth of second child	Ellie Kemper reveals her second child, Matthew, was born in September.	https://www.msn.com/en-us/tv/tv-celebrity/ellie-kemper-announces-birth-of-second-child/ar-AAIkZri?ocid=chopendata	[{"Label": "Ellie Kemper", "Type": "P", "WikidataId": "Q72077", "Confidence": 1.0, "OccurrenceOffsets": [0], "SurfaceForms": ["Ellie Kemper"]}]	[{"Label": "Ellie Kemper", "Type": "P", "WikidataId": "Q72077", "Confidence": 1.0, "OccurrenceOffsets": [0], "SurfaceForms": ["Ellie Kemper"]}]
N24752	sports	football_nfl	Watch: Dolphins pull off trickery with fake punt against Redskins	The Dolphins have had very few highlights this season, but this well-executed fake punt against the Redskins was one of them.	https://www.msn.com/en-us/sports/nfl/watch-dolphins-pull-off-trickery-with-fake-punt-against-redskins/ar-AAIIJdL?ocid=chopendata	[{"Label": "Fake punt", "Type": "U", "WikidataId": "Q28453693", "Confidence": 1.0, "OccurrenceOffsets": [39], "SurfaceForms": ["fake punt"]}, {"Label": "Miami Dolphins", "Type": "O", "WikidataId": "Q223243", "Confidence": 0.993, "OccurrenceOffsets": [7], "SurfaceForms": ["Dolphins"]}, {"Label": "Washington Redskins", "Type": "O", "WikidataId": "Q212654", "Confidence": 0.994, "OccurrenceOffsets": [57], "SurfaceForms": ["Redskins"]}]	[{"Label": "Fake punt", "Type": "U", "WikidataId": "Q28453693", "Confidence": 1.0, "OccurrenceOffsets": [78], "SurfaceForms": ["fake punt"]}, {"Label": "Miami Dolphins", "Type": "O", "WikidataId": "Q223243", "Confidence": 0.993, "OccurrenceOffsets": [4], "SurfaceForms": ["Dolphins"]}, {"Label": "Washington Redskins", "Type": "O", "WikidataId": "Q212654", "Confidence": 0.994, "OccurrenceOffsets": [100], "SurfaceForms": ["Redskins"]}]
N16939	news	newsworld	Despite Baghdadi raid, some analysts question U.S. ability to prevent ISIS resurgence	A reduced American footprint may prevent the U.S. from mounting the kind of counterterrorism campaign that brought down the caliphate.	https://www.msn.com/en-us/news/newsworld/despite-baghdadi-raid,-some-analysts-question-u.s.-ability-to-prevent-isis-resurgence/ar-AAJrHZb?ocid=chopendata	[{"Label": "Islamic State of Iraq and the Levant", "Type": "U", "WikidataId": "Q2429253", "Confidence": 1.0, "OccurrenceOffsets": [70], "SurfaceForms": ["ISIS"]}, {"Label": "United States", "Type": "G", "WikidataId": "Q30", "Confidence": 0.999, "OccurrenceOffsets": [46], "SurfaceForms": ["U.S."]}, {"Label": "Abu Bakr al-Baghdadi", "Type": "P", "WikidataId": "Q2821724", "Confidence": 0.984, "OccurrenceOffsets": [8], "SurfaceForms": ["Baghdadi"]}]	[{"Label": "United States", "Type": "G", "WikidataId": "Q30", "Confidence": 0.999, "OccurrenceOffsets": [45], "SurfaceForms": ["U.S."]}]
N25445	lifestyle	lifestyledidyouknow	What the world was like when your grandparents were born	From the devastating Civil War battles to abolition to the ravages of not one but two world wars, the world has changed immeasurably in the last 150 years. To examine what was going on that led to so much upheaval, Stacker explores what the world was like when your grandparents were born.	https://www.msn.com/en-us/lifestyle/lifestyledidyouknow/what-the-world-was-like-when-your-grandparents-were-born/ss-AAEboAX?ocid=chopendata	[]	[{"Label": "American Civil War", "Type": "E", "WikidataId": "Q8676", "Confidence": 0.997, "OccurrenceOffsets": [21], "SurfaceForms": ["Civil War"]}]
N1054	news	newspolitics	Mick Mulvaney's bad week just got worse		https://www.msn.com/en-us/news/newspolitics/mick-mulvaney's-bad-week-just-got-worse/ar-AAJ4PM9?ocid=chopendata	[{"Label": "Mick Mulvaney", "Type": "P", "WikidataId": "Q1235731", "Confidence": 1.0, "OccurrenceOffsets": [0], "SurfaceForms": ["Mick Mulvaney"]}]	[]
N11385	lifestyle	lifestylehomeandgarden	The Most Annoying Fall Pests and How to Manage Them	Fall is the season where bugs and other pests start seeking warmer areas to settle in before the cold hits and that makes your home a popular destination. Here's how to manage fall's most annoying pests.	https://www.msn.com/en-us/lifestyle/lifestylehomeandgarden/the-most-annoying-fall-pests-and-how-to-manage-them/ss-AAHuXLK?ocid=chopendata	[]	[]
N2862	sports	football_nfl	Sunday Night Football: Green Bay Packers @ Kansas City Chiefs Live Thread & Game Information		https://www.msn.com/en-us/sports/nfl/sunday-night-football-green-bay-packers-kansas-city-chiefs-live-thread-game-information/ar-AAJrHZo?ocid=chopendata	[{"Label": "Kansas City Chiefs", "Type": "O", "WikidataId": "Q223522", "Confidence": 1.0, "OccurrenceOffsets": [43], "SurfaceForms": ["Kansas City Chiefs"]}, {"Label": "NBC Sunday Night Football", "Type": "W", "WikidataId": "Q6952794", "Confidence": 1.0, "OccurrenceOffsets": [0], "SurfaceForms": ["Sunday Night Football"]}, {"Label": "Green Bay Packers", "Type": "O", "WikidataId": "Q213837", "Confidence": 1.0, "OccurrenceOffsets": [23], "SurfaceForms": ["Green Bay Packers"]}]	[]
N28447	news	newsworld	Obama endorses Justin Trudeau for reelection in Canada	Former President Barack Obama endorsed Canadian Prime Minister Justin Trudeau in his reelection effort Wednesday, part of an attempt to boost the embattled leader's chances of staying in office.	https://www.msn.com/en-us/news/world/obama-endorses-justin-trudeau-for-reelection-in-canada/ar-AAISzSY?ocid=chopendata	[{"Label": "Justin Trudeau", "Type": "P", "WikidataId": "Q3099714", "Confidence": 1.0, "OccurrenceOffsets": [15], "SurfaceForms": ["Justin Trudeau"]}, {"Label": "Barack Obama", "Type": "P", "WikidataId": "Q76", "Confidence": 1.0, "OccurrenceOffsets": [0], "SurfaceForms": ["Obama"]}, {"Label": "Canada", "Type": "G", "WikidataId": "Q16", "Confidence": 0.966, "OccurrenceOffsets": [], "SurfaceForms": []}]	[{"Label": "Justin Trudeau", "Type": "P", "WikidataId": "Q3099714", "Confidence": 1.0, "OccurrenceOffsets": [63], "SurfaceForms": ["Justin Trudeau"]}, {"Label": "Barack Obama", "Type": "P", "WikidataId": "Q76", "Confidence": 1.0, "OccurrenceOffsets": [17], "SurfaceForms": ["Barack Obama"]}, {"Label": "Prime Minister of Canada", "Type": "K", "WikidataId": "Q839078", "Confidence": 0.995, "OccurrenceOffsets": [39], "SurfaceForms": ["Canadian Prime Minister"]}]
N20208	news	newsworld	Pentagon chief to focus on Turkey, Syria at NATO, but short on options	Pentagon chief to focus on Turkey, Syria at NATO, but short on options	https://www.msn.com/en-us/news/newsworld/pentagon-chief-to-focus-on-turkey,-syria-at-nato,-but-short-on-options/ar-AAJgYtJ?ocid=chopendata	[{"Label": "Turkey", "Type": "G", "WikidataId": "Q43", "Confidence": 1.0, "OccurrenceOffsets": [27], "SurfaceForms": ["Turkey"]}, {"Label": "Syria", "Type": "G", "WikidataId": "Q858", "Confidence": 0.995, "OccurrenceOffsets": [35], "SurfaceForms": ["Syria"]}, {"Label": "NATO", "Type": "O", "WikidataId": "Q7184", "Confidence": 1.0, "OccurrenceOffsets": [44], "SurfaceForms": ["NATO"]}]	[{"Label": "Turkey", "Type": "G", "WikidataId": "Q43", "Confidence": 1.0, "OccurrenceOffsets": [27], "SurfaceForms": ["Turkey"]}, {"Label": "Syria", "Type": "G", "WikidataId": "Q858", "Confidence": 0.995, "OccurrenceOffsets": [35], "SurfaceForms": ["Syria"]}, {"Label": "NATO", "Type": "O", "WikidataId": "Q7184", "Confidence": 1.0, "OccurrenceOffsets": [44], "SurfaceForms": ["NATO"]}]
N6111	health	weightloss	These Are the 7 Worst Diet Mistakes for Weight Loss (That Can Actually Cause Weight Gain!)	We asked three registered dietitians to share the biggest diet mistakes they see clients make that won't help them lose weight and can actually lead to weight gain.	https://www.msn.com/en-us/health/weightloss/these-are-the-7-worst-diet-mistakes-for-weight-loss-(that-can-actually-cause-weight-gain!)/ss-AAI10vi?ocid=chopendata	[]	[]
N144	news	newsus	Cape Cod Study Finds No Easy Way to Stop Shark Attacks	A new study considered everything from kelp-forest barriers to seal contraception to ward off sharks along Cape Cod's beaches but found no magic-bullet method for guaranteeing public safety.	https://www.msn.com/en-us/news/newsus/cape-cod-study-finds-no-easy-way-to-stop-shark-attacks/ar-AAISIyn?ocid=chopendata	[{"Label": "Cape Cod", "Type": "L", "WikidataId": "Q49152", "Confidence": 0.997, "OccurrenceOffsets": [0], "SurfaceForms": ["Cape Cod"]}]	[{"Label": "Cape Cod", "Type": "L", "WikidataId": "Q49152", "Confidence": 0.997, "OccurrenceOffsets": [107], "SurfaceForms": ["Cape Cod"]}]
N12570	news	newsworld	Erdogan's Ambitions Go Beyond Syria. He Says He Wants Nuclear Weapons.	WASHINGTON   Turkey's president, Recep Tayyip Erdogan, wants more than control over a wide swath of Syria along his country's border. He says he wants the Bomb. In the weeks leading up to his order to launch the military across the border to clear Kurdish areas, Mr. Erdogan made no secret of his larger ambition. "Some countries have missiles with nuclear warheads," he told a meeting of his governing party in September. But the West insists "we...	https://www.msn.com/en-us/news/world/erdogans-ambitions-go-beyond-syria-he-says-he-wants-nuclear-weapons/ar-AAJ4PPg?ocid=chopendata	[{"Label": "Syria", "Type": "G", "WikidataId": "Q858", "Confidence": 0.999, "OccurrenceOffsets": [30], "SurfaceForms": ["Syria"]}, {"Label": "Nuclear weapon", "Type": "C", "WikidataId": "Q650051", "Confidence": 0.996, "OccurrenceOffsets": [54], "SurfaceForms": ["Nuclear Weapons"]}, {"Label": "Recep Tayyip Erdo\u011fan", "Type": "P", "WikidataId": "Q39259", "Confidence": 1.0, "OccurrenceOffsets": [0], "SurfaceForms": ["Erdogan"]}]	[{"Label": "Kurdistan", "Type": "G", "WikidataId": "Q41470", "Confidence": 1.0, "OccurrenceOffsets": [248], "SurfaceForms": ["Kurdish areas"]}, {"Label": "Syria", "Type": "G", "WikidataId": "Q858", "Confidence": 0.999, "OccurrenceOffsets": [100], "SurfaceForms": ["Syria"]}, {"Label": "Nuclear weapon", "Type": "C", "WikidataId": "Q650051", "Confidence": 0.996, "OccurrenceOffsets": [155], "SurfaceForms": ["Bomb"]}, {"Label": "Recep Tayyip Erdo\u011fan", "Type": "P", "WikidataId": "Q39259", "Confidence": 1.0, "OccurrenceOffsets": [33, 267], "SurfaceForms": ["Recep Tayyip Erdogan", "Erdogan"]}, {"Label": "President of Turkey", "Type": "K", "WikidataId": "Q1922067", "Confidence": 1.0, "OccurrenceOffsets": [13], "SurfaceForms": ["Turkey's president"]}]
N11296	finance	finance-real-estate	What property buyers should know about land loans	The best type of loan depends on the property and what you plan to do with it.	https://www.msn.com/en-us/finance/finance-real-estate/what-property-buyers-should-know-about-land-loans/ar-AAISzTK?ocid=chopendata	[]	[]
N28329	sports	football_ncaa	Surveillance video released of ex-Oregon WR Lowe disarming gunman in May		https://www.msn.com/en-us/sports/football_ncaa/surveillance-video-released-of-ex-oregon-wr-lowe-disarming-gunman-in-may/ar-AAJ0B3L?ocid=chopendata	[]	[]
N18825	news	newsscienceandtechnology	Fortnite's black hole has closed, and Chapter 2 is finally here	It took a while, but the black hole did its job	https://www.msn.com/en-us/news/newsscienceandtechnology/fortnite's-black-hole-has-closed,-and-chapter-2-is-finally-here/ar-AAIO1eg?ocid=chopendata	[{"Label": "Fortnite", "Type": "W", "WikidataId": "Q349375", "Confidence": 0.999, "OccurrenceOffsets": [0], "SurfaceForms": ["Fortnite"]}]	[]
N11008	lifestyle	lifestylehomeandgarden	55 Ways You're Ruining Your Home and Don't Even Know It	Before you incur thousands in repair costs, make sure you quit practicing these habits that are causing property damage (without you realizing it).	https://www.msn.com/en-us/lifestyle/lifestylehomeandgarden/55-ways-you're-ruining-your-home-and-don't-even-know-it/ss-AAI19P6?ocid=chopendata	[{"Label": "Your Home", "Type": "U", "WikidataId": "Q17060160", "Confidence": 1.0, "OccurrenceOffsets": [23], "SurfaceForms": ["Your Home"]}]	[]
N7014	finance	finance-real-estate	5 Home Repairs You Should Not Attempt Yourself	DIY can be cheaper, but some projects are better left to licensed professionals.	https://www.msn.com/en-us/finance/finance-real-estate/5-home-repairs-you-should-not-attempt-yourself/ar-AAIpgMc?ocid=chopendata	[{"Label": "Home repair", "Type": "C", "WikidataId": "Q5889160", "Confidence": 1.0, "OccurrenceOffsets": [2], "SurfaceForms": ["Home Repairs"]}]	[]
N16869	autos	autosnews	Pedestrian killed in Friday collision in Fort Collins	A pedestrian is dead after being hit by a minivan on Harmony Road in Fort Collins. The investigation is ongoing.	https://www.msn.com/en-us/autos/autosnews/pedestrian-killed-in-friday-collision-in-fort-collins/ar-AAIGx8k?ocid=chopendata	[{"Label": "Fort Collins, Colorado", "Type": "G", "WikidataId": "Q490732", "Confidence": 1.0, "OccurrenceOffsets": [41], "SurfaceForms": ["Fort Collins"]}]	[{"Label": "Fort Collins, Colorado", "Type": "G", "WikidataId": "Q490732", "Confidence": 1.0, "OccurrenceOffsets": [69], "SurfaceForms": ["Fort Collins"]}]
N24923	sports	basketball_nba	Sacramento Kings waive Hollis Thompson and Tyler Ulis, keep Tyler Lydon	Is Lydon the surprise player?	https://www.msn.com/en-us/sports/basketball_nba/sacramento-kings-waive-hollis-thompson-and-tyler-ulis,-keep-tyler-lydon/ar-AAJ4PPm?ocid=chopendata	[{"Label": "Tyler Lydon", "Type": "P", "WikidataId": "Q29109468", "Confidence": 1.0, "OccurrenceOffsets": [60], "SurfaceForms": ["Tyler Lydon"]}, {"Label": "Sacramento Kings", "Type": "O", "WikidataId": "Q166105", "Confidence": 1.0, "OccurrenceOffsets": [0], "SurfaceForms": ["Sacramento Kings"]}, {"Label": "Hollis Thompson", "Type": "P", "WikidataId": "Q5881607", "Confidence": 1.0, "OccurrenceOffsets": [23], "SurfaceForms": ["Hollis Thompson"]}, {"Label": "Tyler Ulis", "Type": "P", "WikidataId": "Q17038792", "Confidence": 1.0, "OccurrenceOffsets": [43], "SurfaceForms": ["Tyler Ulis"]}]	[{"Label": "Tyler Lydon", "Type": "P", "WikidataId": "Q29109468", "Confidence": 1.0, "OccurrenceOffsets": [3], "SurfaceForms": ["Lydon"]}]
N23905	tv	tv-celebrity	'Clueless' star Stacey Dash arrested for domestic violence	Stacey allegedly slapped and pushed her husband.	https://www.msn.com/en-us/tv/tv-celebrity/'clueless'-star-stacey-dash-arrested-for-domestic-violence/ar-AAI4f0i?ocid=chopendata	[{"Label": "Stacey Dash", "Type": "P", "WikidataId": "Q454328", "Confidence": 1.0, "OccurrenceOffsets": [16], "SurfaceForms": ["Stacey Dash"]}]	[{"Label": "Stacey Dash", "Type": "P", "WikidataId": "Q454328", "Confidence": 1.0, "OccurrenceOffsets": [0], "SurfaceForms": ["Stacey"]}]
N7421	foodanddrink	videos	If You Ordered Less, Should You Still Split the Bill Evenly?	Figuring out the bill after dinner can be a sticky situation. Someone suggested splitting the check, but you only got one thing. Here's what to do to avoid any awkwardness.	https://www.msn.com/en-us/foodanddrink/videos/if-you-ordered-less,-should-you-still-split-the-bill-evenly?/vi-AAIO1fx?ocid=chopendata	[]	[]
N5815	news	factcheck	Fact check: Could a President Beto O'Rourke confiscate assault weapons?	Former Texas Congressman Beto O'Rourke has made his position on assault weapons crystal clear. "Hell, yes, we're going to take your AR-15, your AK-47," O'Rourke said during Thursday's Democratic debate. But could he?	https://www.msn.com/en-us/news/factcheck/fact-check-could-a-president-beto-orourke-confiscate-assault-weapons/ar-AAHidgT?ocid=chopendata	[{"Label": "Beto O'Rourke", "Type": "P", "WikidataId": "Q4014532", "Confidence": 1.0, "OccurrenceOffsets": [30], "SurfaceForms": ["Beto O'Rourke"]}]	[{"Label": "Beto O'Rourke", "Type": "P", "WikidataId": "Q4014532", "Confidence": 1.0, "OccurrenceOffsets": [25, 152], "SurfaceForms": ["Beto O'Rourke", "O'Rourke"]}, {"Label": "AR-15 style rifle", "Type": "U", "WikidataId": "Q6889079", "Confidence": 0.996, "OccurrenceOffsets": [132], "SurfaceForms": ["AR-15"]}, {"Label": "AK-47", "Type": "B", "WikidataId": "Q37116", "Confidence": 1.0, "OccurrenceOffsets": [144], "SurfaceForms": ["AK-47"]}, {"Label": "Texas", "Type": "G", "WikidataId": "Q1439", "Confidence": 0.998, "OccurrenceOffsets": [7], "SurfaceForms": ["Texas"]}]
N6926	video	viral	Officer escapes serious injury after truck spins out of control	A truck lost control and struck the officer's vehicle as an officer responded to a crash in heavy rain on Utah's I-15.	https://www.msn.com/en-us/video/viral/officer-escapes-serious-injury-after-truck-spins-out-of-control/vi-AAI1AFh?ocid=chopendata	[]	[]
N17654	health	medical	Why Is PCOS Still So Hard for Doctors to Understand?	Advocates and researchers are pushing for awareness of polycystic ovary syndrome.	https://www.msn.com/en-us/health/medical/why-is-pcos-still-so-hard-for-doctors-to-understand?/ar-AAHdgkN?ocid=chopendata	[{"Label": "Polycystic ovary syndrome", "Type": "C", "WikidataId": "Q500816", "Confidence": 1.0, "OccurrenceOffsets": [7], "SurfaceForms": ["PCOS"]}]	[]
N7629	news	newsus	Official's homophobic slur ignites explosive reaction against Tennessee tourism hot spot	Commissioner Warren Hurst used a homophobic slur to describe presidential candidate Pete Buttigieg, setting off widespread criticism.	https://www.msn.com/en-us/news/newsus/official's-homophobic-slur-ignites-explosive-reaction-against-tennessee-tourism-hot-spot/ar-AAJaEAu?ocid=chopendata	[{"Label": "Tennessee", "Type": "G", "WikidataId": "Q1509", "Confidence": 1.0, "OccurrenceOffsets": [62], "SurfaceForms": ["Tennessee"]}]	[{"Label": "Pete Buttigieg", "Type": "P", "WikidataId": "Q7173106", "Confidence": 1.0, "OccurrenceOffsets": [84], "SurfaceForms": ["Pete Buttigieg"]}]
N5634	autos	autossports	How Can This Be? The Mid-Engine Corvette's Forward Visibility is Actually Worse Than the Front-Engine C7's	And our test data proves that it's not just a perception.	https://www.msn.com/en-us/autos/autossports/how-can-this-be?-the-mid-engine-corvette's-forward-visibility-is-actually-worse-than-the-front-engine-c7's/ar-AAISIzR?ocid=chopendata	[]	[]
N19377	foodanddrink	foodrecipes	125 Cast Iron Recipes for Fall	Break out Grandma's well-seasoned cast iron and whip up some heavenly, comforting fall recipes.	https://www.msn.com/en-us/foodanddrink/foodrecipes/125-cast-iron-recipes-for-fall/ss-AAHB659?ocid=chopendata	[{"Label": "Cast iron", "Type": "C", "WikidataId": "Q483269", "Confidence": 1.0, "OccurrenceOffsets": [4], "SurfaceForms": ["Cast Iron"]}]	[{"Label": "Grandma's Marathon", "Type": "E", "WikidataId": "Q1543025", "Confidence": 0.972, "OccurrenceOffsets": [10], "SurfaceForms": ["Grandma's"]}]
N17609	sports	baseball_mlb	Marvin Miller gets another shot at MLB's Hall of Fame as a member of the Modern Era ballot	Marvin Miller   the man responsible for strengthening the players' union   is once again up for induction into the National Baseball Hall of Fame and Museum. Miller is among the 10 baseball figures on 2020's Modern Baseball Era ballot.	https://www.msn.com/en-us/sports/baseball_mlb/marvin-miller-gets-another-shot-at-mlb's-hall-of-fame-as-a-member-of-the-modern-era-ballot/ar-AAJQElL?ocid=chopendata	[{"Label": "National Baseball Hall of Fame and Museum", "Type": "F", "WikidataId": "Q809892", "Confidence": 1.0, "OccurrenceOffsets": [35], "SurfaceForms": ["MLB's Hall of Fame"]}, {"Label": "Marvin Miller", "Type": "P", "WikidataId": "Q196090", "Confidence": 0.996, "OccurrenceOffsets": [0], "SurfaceForms": ["Marvin Miller"]}]	[{"Label": "National Baseball Hall of Fame and Museum", "Type": "F", "WikidataId": "Q809892", "Confidence": 1.0, "OccurrenceOffsets": [115], "SurfaceForms": ["National Baseball Hall of Fame and Museum"]}, {"Label": "Marvin Miller", "Type": "P", "WikidataId": "Q196090", "Confidence": 0.996, "OccurrenceOffsets": [0, 158], "SurfaceForms": ["Marvin Miller", "Miller"]}]
N9572	news	newscrime	Toddler killed in own driveway by hit-and-run driver, police say	A 21-month-old girl was hit and killed in the driveway of her west-side home by a hit-and-run driver, Indianapolis police said.	https://www.msn.com/en-us/news/newscrime/toddler-killed-in-own-driveway-by-hit-and-run-driver,-police-say/ar-AAJs3UH?ocid=chopendata	[]	[]
N16984	sports	more_sports	The Jets are now the Knicks	The Jets, who have turned into the Knicks, play a new Florida bowl game on Sunday, the Gase Bowl, against the Dolphins. So it's Adam Gase's current team against his old one. The Jets, who have one win, go up against a Dolphins team that doesn't have any. You know what it has been like for the Jets since Sam Darnold came down with mono. We can only imagine how it will read and sound ...	https://www.msn.com/en-us/sports/more_sports/the-jets-are-now-the-knicks/ar-AAJJect?ocid=chopendata	[{"Label": "New York Jets", "Type": "O", "WikidataId": "Q219602", "Confidence": 1.0, "OccurrenceOffsets": [4], "SurfaceForms": ["Jets"]}, {"Label": "New York Knicks", "Type": "O", "WikidataId": "Q131364", "Confidence": 1.0, "OccurrenceOffsets": [21], "SurfaceForms": ["Knicks"]}]	[{"Label": "New York Jets", "Type": "O", "WikidataId": "Q219602", "Confidence": 1.0, "OccurrenceOffsets": [4, 178, 294], "SurfaceForms": ["Jets", "Jets", "Jets"]}, {"Label": "Sam Darnold", "Type": "P", "WikidataId": "Q27049069", "Confidence": 1.0, "OccurrenceOffsets": [305], "SurfaceForms": ["Sam Darnold"]}, {"Label": "Adam Gase", "Type": "P", "WikidataId": "Q4679094", "Confidence": 1.0, "OccurrenceOffsets": [128], "SurfaceForms": ["Adam Gase"]}, {"Label": "Miami Dolphins", "Type": "O", "WikidataId": "Q223243", "Confidence": 0.991, "OccurrenceOffsets": [110, 218], "SurfaceForms": ["Dolphins", "Dolphins"]}, {"Label": "New York Knicks", "Type": "O", "WikidataId": "Q131364", "Confidence": 1.0, "OccurrenceOffsets": [35], "SurfaceForms": ["Knicks"]}, {"Label": "Florida", "Type": "G", "WikidataId": "Q812", "Confidence": 0.962, "OccurrenceOffsets": [54], "SurfaceForms": ["Florida"]}]
N3367	finance	retirement	What to do if your employer changes the terms of your retirement plan	Once the Holy Grail of a secure retirement, pensions are becoming less reliable	https://www.msn.com/en-us/finance/retirement/what-to-do-if-your-employer-changes-the-terms-of-your-retirement-plan/ar-AAIpqUd?ocid=chopendata	[]	[]
N3627	news	newscrime	Motorcyclist dies after crash with car in Queen Creek	A man who was riding a motorcycle died of his injuries after he was involved in a car wreck in Queen Creek on Sunday. The Maricopa County Sheriff's Office said the man, who was not identified, was involved in the crash near Power and Chandler Heights roads around 12:30 p.m. Deputies responded to the crash. The man on the motorcycle was transported to a local hospital with life-threatening injuries and later died. The driver of the car, who was...	https://www.msn.com/en-us/news/newscrime/motorcyclist-dies-after-crash-with-car-in-queen-creek/ar-AAJ4PUF?ocid=chopendata	[{"Label": "Queen Creek, Arizona", "Type": "G", "WikidataId": "Q985299", "Confidence": 0.999, "OccurrenceOffsets": [42], "SurfaceForms": ["Queen Creek"]}]	[{"Label": "Queen Creek, Arizona", "Type": "G", "WikidataId": "Q985299", "Confidence": 0.999, "OccurrenceOffsets": [95], "SurfaceForms": ["Queen Creek"]}, {"Label": "Maricopa County Sheriff's Office", "Type": "O", "WikidataId": "Q576872", "Confidence": 1.0, "OccurrenceOffsets": [122], "SurfaceForms": ["Maricopa County Sheriff's Office"]}, {"Label": "Chandler Heights, Arizona", "Type": "G", "WikidataId": "Q5071166", "Confidence": 1.0, "OccurrenceOffsets": [234], "SurfaceForms": ["Chandler Heights"]}]
N17311	autos	autosclassics	This Montana Man Owns No Fewer Than 26 Oldsmobile Toronados	And that's not all he has.	https://www.msn.com/en-us/autos/autosclassics/this-montana-man-owns-no-fewer-than-26-oldsmobile-toronados/ar-AAIkrut?ocid=chopendata	[{"Label": "Oldsmobile Toronado", "Type": "V", "WikidataId": "Q1537791", "Confidence": 1.0, "OccurrenceOffsets": [50], "SurfaceForms": ["Toronados"]}]	[]
N21552	foodanddrink	restaurantsandnews	I tried to order everything on Taco Bell's secret menu, and it was a total disaster	Taco Bell's secret menu is the stuff of legends, but how real is it, really? Not very, if my experience was any indication.	https://www.msn.com/en-us/foodanddrink/restaurantsandnews/i-tried-to-order-everything-on-taco-bell's-secret-menu,-and-it-was-a-total-disaster/ss-AAJ4AVx?ocid=chopendata	[{"Label": "Taco Bell", "Type": "O", "WikidataId": "Q752941", "Confidence": 1.0, "OccurrenceOffsets": [31], "SurfaceForms": ["Taco Bell"]}]	[{"Label": "Taco Bell", "Type": "O", "WikidataId": "Q752941", "Confidence": 1.0, "OccurrenceOffsets": [0], "SurfaceForms": ["Taco Bell"]}]
N11022	lifestyle	voices	I wanted to learn to swim before I turned 30. Easier said than done.	Floating: easy. Actually swimming: not so much.	https://www.msn.com/en-us/lifestyle/voices/i-wanted-to-learn-to-swim-before-i-turned-30-easier-said-than-done/ar-AACVg1W?ocid=chopendata	[]	[]
N3687	travel	traveltripideas	The 7 'coolest' neighborhoods across the US where the food is good, the art scene is hot, and the culture is thriving	Time Out released the list of the 50 coolest neighborhoods in the world. From Astoria, New York, to Dogpatch, San Fran, here's where you should go.	https://www.msn.com/en-us/travel/traveltripideas/the-7-'coolest'-neighborhoods-across-the-us-where-the-food-is-good,-the-art-scene-is-hot,-and-the-culture-is-thriving/ss-AAIpr71?ocid=chopendata	[]	[{"Label": "Time Out (magazine)", "Type": "M", "WikidataId": "Q2657609", "Confidence": 0.925, "OccurrenceOffsets": [0], "SurfaceForms": ["Time Out"]}, {"Label": "Astoria, Queens", "Type": "G", "WikidataId": "Q121765", "Confidence": 1.0, "OccurrenceOffsets": [78], "SurfaceForms": ["Astoria"]}, {"Label": "Dogpatch, San Francisco", "Type": "G", "WikidataId": "Q5288411", "Confidence": 1.0, "OccurrenceOffsets": [100], "SurfaceForms": ["Dogpatch"]}, {"Label": "San Francisco", "Type": "G", "WikidataId": "Q62", "Confidence": 1.0, "OccurrenceOffsets": [110], "SurfaceForms": ["San Fran"]}]
N21800	sports	football_ncaa	Miami WR Brian Hightower tweets move to transfer portal	Hightower was a four-star 2018 signee for the Hurricanes.	https://www.msn.com/en-us/sports/football_ncaa/miami-wr-brian-hightower-tweets-move-to-transfer-portal/ar-AAJaECX?ocid=chopendata	[]	[]
