N20670	lifestyle	lifestylehomeandgarden	10 Home Questions You've Always Wanted to Ask But Were Too Afraid	Don't worry, you aren't the only homeowner with these questions.	https://www.msn.com/en-us/lifestyle/lifestylehomeandgarden/10-home-questions-you've-always-wanted-to-ask-but-were-too-afraid/ss-AAHBwt8?ocid=chopendata	[{"Label": "Love + Fear", "Type": "N", "WikidataId": "Q61731160", "Confidence": 1.0, "OccurrenceOffsets": [55], "SurfaceForms": ["Too Afraid"]}]	[]
N27369	health	medical	How 17 Under-50 Women Learned They Had Breast Cancer and What Helped Them Through It	A cancer diagnosis is anything but easy and, while it can change a person's life in a million ways, just one of those might be for the better.	https://www.msn.com/en-us/health/medical/how-17-under-50-women-learned-they-had-breast-cancer-and-what-helped-them-through-it/ss-AAHwDiJ?ocid=chopendata	[{"Label": "Breast cancer", "Type": "C", "WikidataId": "Q128581", "Confidence": 1.0, "OccurrenceOffsets": [39], "SurfaceForms": ["Breast Cancer"]}]	[]
N18225	autos	autosenthusiasts	Watch This Dodge Challenger Hellcat Light Itself On Fire On A Dyno Run	In a move surely intended to channel its namesake, a Hellcat on a dyno lit itself on fire. Luckily, the whole situation was resolved without injury and uploaded to YouTube for your viewing pleasure.	https://www.msn.com/en-us/autos/autosenthusiasts/watch-this-dodge-challenger-hellcat-light-itself-on-fire-on-a-dyno-run/ar-AAImSEC?ocid=chopendata	[{"Label": "Hellcat Records", "Type": "O", "WikidataId": "Q1239845", "Confidence": 0.995, "OccurrenceOffsets": [28], "SurfaceForms": ["Hellcat"]}]	[{"Label": "Hellcat Records", "Type": "O", "WikidataId": "Q1239845", "Confidence": 0.995, "OccurrenceOffsets": [53], "SurfaceForms": ["Hellcat"]}, {"Label": "YouTube", "Type": "O", "WikidataId": "Q866", "Confidence": 0.999, "OccurrenceOffsets": [164], "SurfaceForms": ["YouTube"]}]
N13236	movies	movienews	Franco Harris, George A. Romero Make Appearance At Regent Square Theater	The Romero Lives film series continues at Regent Square Theater this weekend.	https://www.msn.com/en-us/movies/movienews/franco-harris,-george-a.-romero-make-appearance-at-regent-square-theater/ar-AAJ4BhE?ocid=chopendata	[]	[]
N19398	news	newsscienceandtechnology	Air Force's X-37B space plane lands after record 780 days in orbit	There was no doubt that the US Air Force's X-37B was going to break its own record for time spent in orbit, but it's now clear by how much. The mysterious Boeing-made space plane has landed at Kennedy Space Center after 780 days in orbit, comfortably surpassing the earlier record of 717 days, 20 hours and 42 minutes.	https://www.msn.com/en-us/news/newsscienceandtechnology/air-force's-x-37b-space-plane-lands-after-record-780-days-in-orbit/ar-AAJrIZl?ocid=chopendata	[{"Label": "Boeing X-37", "Type": "V", "WikidataId": "Q333859", "Confidence": 1.0, "OccurrenceOffsets": [12], "SurfaceForms": ["X-37B"]}, {"Label": "United States Air Force", "Type": "O", "WikidataId": "Q11223", "Confidence": 0.93, "OccurrenceOffsets": [0], "SurfaceForms": ["Air Force"]}]	[{"Label": "Boeing X-37", "Type": "V", "WikidataId": "Q333859", "Confidence": 1.0, "OccurrenceOffsets": [43], "SurfaceForms": ["X-37B"]}, {"Label": "United States Air Force", "Type": "O", "WikidataId": "Q11223", "Confidence": 0.93, "OccurrenceOffsets": [28], "SurfaceForms": ["US Air Force"]}, {"Label": "Kennedy Space Center", "Type": "O", "WikidataId": "Q48821", "Confidence": 1.0, "OccurrenceOffsets": [193], "SurfaceForms": ["Kennedy Space Center"]}, {"Label": "Boeing", "Type": "O", "WikidataId": "Q66", "Confidence": 0.99, "OccurrenceOffsets": [155], "SurfaceForms": ["Boeing"]}]
N8096	foodanddrink	newstrends	Bucket-List Food Experiences in Every State	America offers foodies a mega-mosaic of cuisines to explore state by state. These unique favorites provide interesting insights and tastes of the local culture. Reindeer hot dogs, persimmon pudding, Rocky Mountain oysters (which don't come from the sea), and pig ear sandwiches are just some of treats to hunt down.	https://www.msn.com/en-us/foodanddrink/newstrends/bucket-list-food-experiences-in-every-state/ss-AAFqces?ocid=chopendata	[{"Label": "U.S. state", "Type": "U", "WikidataId": "Q35657", "Confidence": 0.947, "OccurrenceOffsets": [38], "SurfaceForms": ["State"]}]	[{"Label": "United States", "Type": "G", "WikidataId": "Q30", "Confidence": 0.985, "OccurrenceOffsets": [0], "SurfaceForms": ["America"]}]
N10209	news	newsgoodnews	A 'miracle' and a 'shock': Months later, D.C. woman meets the stranger whose life she saved	In early August, strangers banded together to save the life of a D.C. man who suffered a sudden heart attack. At a ceremony Thursday, he met them to say thanks.	https://www.msn.com/en-us/news/newsgoodnews/a-miracle-and-a-shock-months-later-d-c-woman-meets-the-stranger-whose-life-she-saved/ar-AAIfsOK?ocid=chopendata	[{"Label": "Washington, D.C.", "Type": "G", "WikidataId": "Q61", "Confidence": 0.979, "OccurrenceOffsets": [41], "SurfaceForms": ["D.C."]}]	[{"Label": "Washington, D.C.", "Type": "G", "WikidataId": "Q61", "Confidence": 0.979, "OccurrenceOffsets": [65], "SurfaceForms": ["D.C."]}]
N9738	movies	movies-celebrity	Paul Rudd on Playing the "Nice Guy," Empowering His Kids to Be Politically Aware	Describing himself as a "beta male" with occasional alpha tendencies, Rudd explained during the New Yorker Festival panel how leaning into that with his characters in 'Our Idiot Brother' and 'I Love You, Man' helped him deliver more "vulnerable human moments."	https://www.msn.com/en-us/movies/movies-celebrity/paul-rudd-on-playing-the-"nice-guy,"-empowering-his-kids-to-be-politically-aware/ar-AAIHgva?ocid=chopendata	[{"Label": "Paul Rudd", "Type": "P", "WikidataId": "Q276525", "Confidence": 1.0, "OccurrenceOffsets": [0], "SurfaceForms": ["Paul Rudd"]}, {"Label": "Nice guy", "Type": "C", "WikidataId": "Q1377145", "Confidence": 1.0, "OccurrenceOffsets": [26], "SurfaceForms": ["Nice Guy"]}, {"Label": "Kids (film)", "Type": "W", "WikidataId": "Q646426", "Confidence": 0.964, "OccurrenceOffsets": [52], "SurfaceForms": ["Kids"]}]	[{"Label": "Paul Rudd", "Type": "P", "WikidataId": "Q276525", "Confidence": 1.0, "OccurrenceOffsets": [70], "SurfaceForms": ["Rudd"]}, {"Label": "The New Yorker Festival", "Type": "U", "WikidataId": "Q20858444", "Confidence": 1.0, "OccurrenceOffsets": [96], "SurfaceForms": ["New Yorker Festival"]}, {"Label": "I Love You, Man", "Type": "W", "WikidataId": "Q958257", "Confidence": 1.0, "OccurrenceOffsets": [192], "SurfaceForms": ["I Love You, Man"]}, {"Label": "Our Idiot Brother", "Type": "W", "WikidataId": "Q1372081", "Confidence": 1.0, "OccurrenceOffsets": [168], "SurfaceForms": ["Our Idiot Brother"]}]
N16295	tv	tv-celebrity	Rob Kardashian Appears Thinner at Kim Kardashian's Birthday Party in Rare Video	Rob Kardashian Appears Thinner at Kim Kardashian's Birthday Party	https://www.msn.com/en-us/tv/tv-celebrity/rob-kardashian-appears-thinner-at-kim-kardashian's-birthday-party-in-rare-video/ar-AAJaFFx?ocid=chopendata	[{"Label": "Kim Kardashian", "Type": "P", "WikidataId": "Q186304", "Confidence": 1.0, "OccurrenceOffsets": [34], "SurfaceForms": ["Kim Kardashian"]}]	[{"Label": "Kim Kardashian", "Type": "P", "WikidataId": "Q186304", "Confidence": 1.0, "OccurrenceOffsets": [34], "SurfaceForms": ["Kim Kardashian"]}]
N21350	news	newscrime	1 Killed, 1 Wounded In Princeton Park Shooting	A man was killed and a woman was seriously wounded when they were shot while sitting in a parked car early Sunday in the Princeton Park neighborhood.	https://www.msn.com/en-us/news/newscrime/1-killed,-1-wounded-in-princeton-park-shooting/ar-AAJ4qYt?ocid=chopendata	[{"Label": "Roseland, Chicago", "Type": "G", "WikidataId": "Q3442463", "Confidence": 1.0, "OccurrenceOffsets": [23], "SurfaceForms": ["Princeton Park"]}]	[{"Label": "Roseland, Chicago", "Type": "G", "WikidataId": "Q3442463", "Confidence": 1.0, "OccurrenceOffsets": [121], "SurfaceForms": ["Princeton Park"]}]
N10154	entertainment	celebrity	Stars attend the 2019 Governors Awards for the Academy of Motion Picture Arts and Sciences	See which celebs attended the 2019 Governors Awards.	https://www.msn.com/en-us/entertainment/celebrity/stars-attend-the-2019-governors-awards-for-the-academy-of-motion-picture-arts-and-sciences/ss-AAJs5Sj?ocid=chopendata	[{"Label": "Academy of Motion Picture Arts and Sciences", "Type": "O", "WikidataId": "Q212329", "Confidence": 1.0, "OccurrenceOffsets": [47], "SurfaceForms": ["Academy of Motion Picture Arts and Sciences"]}, {"Label": "Governors Awards", "Type": "B", "WikidataId": "Q5589762", "Confidence": 1.0, "OccurrenceOffsets": [22], "SurfaceForms": ["Governors Awards"]}]	[{"Label": "Governors Awards", "Type": "B", "WikidataId": "Q5589762", "Confidence": 1.0, "OccurrenceOffsets": [35], "SurfaceForms": ["Governors Awards"]}]
N10244	sports	more_sports	Analysis: In prove-it test vs. undefeated 49ers, Panthers flunk in every way possible		https://www.msn.com/en-us/sports/more-sports/analysis-in-prove-it-test-vs-undefeated-49ers-panthers-flunk-in-every-way-possible/ar-AAJrIcn?ocid=chopendata	[{"Label": "Carolina Panthers", "Type": "O", "WikidataId": "Q330120", "Confidence": 1.0, "OccurrenceOffsets": [49], "SurfaceForms": ["Panthers"]}, {"Label": "San Francisco 49ers", "Type": "O", "WikidataId": "Q337758", "Confidence": 1.0, "OccurrenceOffsets": [42], "SurfaceForms": ["49ers"]}]	[]
N5678	news	newsworld	One of Europe's last wild rivers is in danger of being tamed	Under a broad plane tree near Albania's border with Greece, Jorgji Ilia fills a battered flask from one of the Vjosa River's many springs.	https://www.msn.com/en-us/news/world/one-of-europes-last-wild-rivers-is-in-danger-of-being-tamed/ar-AAJ9vQk?ocid=chopendata	[{"Label": "Europe", "Type": "L", "WikidataId": "Q46", "Confidence": 0.995, "OccurrenceOffsets": [7], "SurfaceForms": ["Europe"]}]	[{"Label": "Ao\u00f6s", "Type": "L", "WikidataId": "Q81503", "Confidence": 1.0, "OccurrenceOffsets": [111], "SurfaceForms": ["Vjosa River"]}, {"Label": "Albania", "Type": "G", "WikidataId": "Q222", "Confidence": 1.0, "OccurrenceOffsets": [30], "SurfaceForms": ["Albania"]}, {"Label": "Greece", "Type": "G", "WikidataId": "Q41", "Confidence": 1.0, "OccurrenceOffsets": [52], "SurfaceForms": ["Greece"]}]
N9706	lifestyle	voices	How Racism Made Me a Louder and Prouder Latina	When I first moved across the Atlantic Ocean - from Puerto Rico to Syracuse, NY - the last thing on my mind was the fact that speaking Spanish, my native language, was very much unwelcome.	https://www.msn.com/en-us/lifestyle/voices/how-racism-made-me-a-louder-and-prouder-latina/ar-AAIfsdb?ocid=chopendata	[]	[{"Label": "Syracuse, New York", "Type": "G", "WikidataId": "Q128069", "Confidence": 1.0, "OccurrenceOffsets": [67], "SurfaceForms": ["Syracuse"]}, {"Label": "Puerto Rico", "Type": "G", "WikidataId": "Q1183", "Confidence": 0.998, "OccurrenceOffsets": [52], "SurfaceForms": ["Puerto Rico"]}, {"Label": "Atlantic Ocean", "Type": "L", "WikidataId": "Q97", "Confidence": 1.0, "OccurrenceOffsets": [30], "SurfaceForms": ["Atlantic Ocean"]}, {"Label": "New York (state)", "Type": "G", "WikidataId": "Q1384", "Confidence": 0.999, "OccurrenceOffsets": [77], "SurfaceForms": ["NY"]}]
N25741	sports	basketball_nba	Blazers coach Terry Stotts backs Daryl Morey over Hong Kong tweet	People within the NBA community are slowly starting to back Daryl Morey after the Houston Rockets general manager started a firestorm by tweeting about the protests in Hong Kong, and Portland Trail Blazers head coach Terry Stotts is among those who supports Morey's point of view.	https://www.msn.com/en-us/sports/basketball_nba/blazers-coach-terry-stotts-backs-daryl-morey-over-hong-kong-tweet/ar-AAISJtQ?ocid=chopendata	[{"Label": "Daryl Morey", "Type": "P", "WikidataId": "Q5226214", "Confidence": 1.0, "OccurrenceOffsets": [33], "SurfaceForms": ["Daryl Morey"]}, {"Label": "Terry Stotts", "Type": "P", "WikidataId": "Q2348679", "Confidence": 1.0, "OccurrenceOffsets": [14], "SurfaceForms": ["Terry Stotts"]}, {"Label": "Portland Trail Blazers", "Type": "O", "WikidataId": "Q167253", "Confidence": 1.0, "OccurrenceOffsets": [0], "SurfaceForms": ["Blazers"]}, {"Label": "Hong Kong", "Type": "G", "WikidataId": "Q8646", "Confidence": 0.988, "OccurrenceOffsets": [50], "SurfaceForms": ["Hong Kong"]}]	[{"Label": "Daryl Morey", "Type": "P", "WikidataId": "Q5226214", "Confidence": 1.0, "OccurrenceOffsets": [60, 258], "SurfaceForms": ["Daryl Morey", "Morey"]}, {"Label": "Terry Stotts", "Type": "P", "WikidataId": "Q2348679", "Confidence": 1.0, "OccurrenceOffsets": [217], "SurfaceForms": ["Terry Stotts"]}, {"Label": "Portland Trail Blazers", "Type": "O", "WikidataId": "Q167253", "Confidence": 1.0, "OccurrenceOffsets": [183], "SurfaceForms": ["Portland Trail Blazers"]}, {"Label": "National Basketball Association", "Type": "O", "WikidataId": "Q155223", "Confidence": 1.0, "OccurrenceOffsets": [18], "SurfaceForms": ["NBA"]}, {"Label": "Hong Kong", "Type": "G", "WikidataId": "Q8646", "Confidence": 0.988, "OccurrenceOffsets": [168], "SurfaceForms": ["Hong Kong"]}, {"Label": "Houston Rockets", "Type": "O", "WikidataId": "Q161345", "Confidence": 1.0, "OccurrenceOffsets": [82], "SurfaceForms": ["Houston Rockets"]}]
N2271	lifestyle	lifestylehomeandgarden	23 Scary Signs Your Home Is a Fire Risk	Want to keep your whole family safe? Discover some of the surprising things that professionals say put your house at risk of a home fire.	https://www.msn.com/en-us/lifestyle/lifestylehomeandgarden/23-scary-signs-your-home-is-a-fire-risk/ss-AAHBySL?ocid=chopendata	[{"Label": "Your Home", "Type": "U", "WikidataId": "Q17060160", "Confidence": 1.0, "OccurrenceOffsets": [15], "SurfaceForms": ["Your Home"]}]	[{"Label": "Jagged Little Pill", "Type": "W", "WikidataId": "Q750084", "Confidence": 1.0, "OccurrenceOffsets": [103], "SurfaceForms": ["your house"]}]
N14173	sports	football_nfl_videos	Who will be the brightest star in Week 8?	The "Good Morning Football" crew discusses who will standout in Week 8.	https://www.msn.com/en-us/sports/football_nfl_videos/who-will-be-the-brightest-star-in-week-8/vi-AAJl8m5?ocid=chopendata	[]	[{"Label": "Good Morning Football", "Type": "W", "WikidataId": "Q28127443", "Confidence": 1.0, "OccurrenceOffsets": [5], "SurfaceForms": ["Good Morning Football"]}]
N6200	news	newscrime	Admissions scandal: Mom who rigged son's ACT, lied about his race gets 3 weeks in prison	LOS ANGELES - A federal judge handed down a three-week prison sentence for Marjorie Klapper, a white Menlo Park mother whose son applied to college with a fraudulent ACT score and an application that falsely portrayed him as black, Latino and the first in his family to attend college.	https://www.msn.com/en-us/news/crime/admissions-scandal-mom-who-rigged-sons-act-lied-about-his-race-gets-3-weeks-in-prison/ar-AAIT16V?ocid=chopendata	[]	[{"Label": "Menlo Park, California", "Type": "G", "WikidataId": "Q74195", "Confidence": 0.981, "OccurrenceOffsets": [101], "SurfaceForms": ["Menlo Park"]}, {"Label": "Los Angeles", "Type": "G", "WikidataId": "Q65", "Confidence": 0.998, "OccurrenceOffsets": [0], "SurfaceForms": ["LOS ANGELES"]}]
N25641	autos	autosnews	Wrong way driver on I-275 crashes head-on with a Maserati; dies	A 39-year-old woman from Lutz died after driving the wrong way on Interstate 275 and crashing head-on into another car. Aryail Gomez was driving a 2019 Mazda SUV southbound on northbound Interstate 275 at about 4:44 p.m., according to a release from the Florida Highway Patrol. Around mile marker 59, Gomez crashed head-on with a Maserati sedan driven by 30-year-old Brittany Castilleja of ...	https://www.msn.com/en-us/autos/autosnews/wrong-way-driver-on-i-275-crashes-head-on-with-a-maserati;-dies/ar-AAIIKg6?ocid=chopendata	[{"Label": "Interstate 275 (Florida)", "Type": "S", "WikidataId": "Q1486480", "Confidence": 0.999, "OccurrenceOffsets": [20], "SurfaceForms": ["I-275"]}, {"Label": "Maserati in motorsport", "Type": "C", "WikidataId": "Q2666342", "Confidence": 0.936, "OccurrenceOffsets": [49], "SurfaceForms": ["Maserati"]}]	[{"Label": "Interstate 275 (Florida)", "Type": "S", "WikidataId": "Q1486480", "Confidence": 0.999, "OccurrenceOffsets": [66, 187], "SurfaceForms": ["Interstate 275", "Interstate 275"]}, {"Label": "Maserati in motorsport", "Type": "C", "WikidataId": "Q2666342", "Confidence": 0.936, "OccurrenceOffsets": [330], "SurfaceForms": ["Maserati"]}, {"Label": "Lutz, Florida", "Type": "G", "WikidataId": "Q1963340", "Confidence": 0.989, "OccurrenceOffsets": [25], "SurfaceForms": ["Lutz"]}, {"Label": "Florida Highway Patrol", "Type": "O", "WikidataId": "Q5461440", "Confidence": 1.0, "OccurrenceOffsets": [254], "SurfaceForms": ["Florida Highway Patrol"]}]
N6249	sports	football_nfl	Here's what head coach Chris Petersen was told about Huskies' kick return penalty	SEATTLE -- By the time the game ended and Washington fell to Oregon 35-31, the play was all but forgotten. But in the minutes after it happened -- and for much of the first quarter -- the moment dominated conversation. A trick play. A controversial penalty. A kick return wiped out. Here's what happened. After the Ducks opened the game with a touchdown drive, the Huskies decided to run ...	https://www.msn.com/en-us/sports/football_nfl/here's-what-head-coach-chris-petersen-was-told-about-huskies'-kick-return-penalty/ar-AAJ4qfx?ocid=chopendata	[{"Label": "Chris Petersen", "Type": "P", "WikidataId": "Q5107742", "Confidence": 1.0, "OccurrenceOffsets": [23], "SurfaceForms": ["Chris Petersen"]}]	[{"Label": "Oregon", "Type": "G", "WikidataId": "Q824", "Confidence": 0.943, "OccurrenceOffsets": [61], "SurfaceForms": ["Oregon"]}, {"Label": "Seattle", "Type": "G", "WikidataId": "Q5083", "Confidence": 1.0, "OccurrenceOffsets": [0], "SurfaceForms": ["SEATTLE"]}]
N10625	news	newsus	Multiple Houses on Fire After Plane Crashes in NJ	At least two houses are on fire in Colonia, New Jersey, after a plane crash, according to the Colonia Fire Department. A Cessna 414 crashed into a home on Berkley Avenue at 11 a.m. Tuesday, according to the FAA. The FAA will conduct an investigation into the cause of the crash. The number of people aboard and their conditions are unknown. The area is a heavy residential area with tree-lined streets. News 4's Dennis Protsko, who is part of the...	https://www.msn.com/en-us/news/us/multiple-houses-on-fire-after-plane-crashes-in-nj/ar-AAJwuEY?ocid=chopendata	[]	[{"Label": "Federal Aviation Administration", "Type": "O", "WikidataId": "Q335357", "Confidence": 0.998, "OccurrenceOffsets": [207, 216], "SurfaceForms": ["FAA", "FAA"]}, {"Label": "Cessna", "Type": "O", "WikidataId": "Q308889", "Confidence": 1.0, "OccurrenceOffsets": [121], "SurfaceForms": ["Cessna"]}, {"Label": "New Jersey", "Type": "G", "WikidataId": "Q1408", "Confidence": 0.998, "OccurrenceOffsets": [44], "SurfaceForms": ["New Jersey"]}, {"Label": "Colonia, New Jersey", "Type": "G", "WikidataId": "Q978569", "Confidence": 1.0, "OccurrenceOffsets": [35], "SurfaceForms": ["Colonia"]}]
N7377	lifestyle	lifestylesmartliving	You Know You're Over 40 If You Love These Things	There are several indicator's to one's age and your likes are one of them. Check out this list of things people over 40 love to find out what they are.	https://www.msn.com/en-us/lifestyle/lifestylesmartliving/you-know-you're-over-40-if-you-love-these-things/ss-AAI4wjq?ocid=chopendata	[{"Label": "These Things", "Type": "C", "WikidataId": "Q7783415", "Confidence": 1.0, "OccurrenceOffsets": [36], "SurfaceForms": ["These Things"]}, {"Label": "Discourse marker", "Type": "C", "WikidataId": "Q1051521", "Confidence": 1.0, "OccurrenceOffsets": [0], "SurfaceForms": ["You Know"]}]	[]
N11448	news	newsus	Family of slain ISIS hostage says they secretly met with her captors in Iraq	Kayla Mueller, a humanitarian worker from Arizona, was held captive, tortured and killed by ISIS.	https://www.msn.com/en-us/news/newsus/family-of-slain-isis-hostage-says-they-secretly-met-with-her-captors-in-iraq/ar-AAJs5X7?ocid=chopendata	[{"Label": "Islamic State of Iraq and the Levant", "Type": "U", "WikidataId": "Q2429253", "Confidence": 0.999, "OccurrenceOffsets": [16], "SurfaceForms": ["ISIS"]}, {"Label": "Iraq", "Type": "G", "WikidataId": "Q796", "Confidence": 0.993, "OccurrenceOffsets": [72], "SurfaceForms": ["Iraq"]}]	[{"Label": "Kayla Mueller", "Type": "P", "WikidataId": "Q19144178", "Confidence": 1.0, "OccurrenceOffsets": [0], "SurfaceForms": ["Kayla Mueller"]}, {"Label": "Islamic State of Iraq and the Levant", "Type": "U", "WikidataId": "Q2429253", "Confidence": 0.999, "OccurrenceOffsets": [92], "SurfaceForms": ["ISIS"]}, {"Label": "Arizona", "Type": "G", "WikidataId": "Q816", "Confidence": 0.958, "OccurrenceOffsets": [42], "SurfaceForms": ["Arizona"]}]
N12222	foodanddrink	foodnews	10 Things You Need to Know About Your Vintage Fiestaware	There's so much to love about America's most colorful and collectible dishes.	https://www.msn.com/en-us/foodanddrink/foodnews/10-things-you-need-to-know-about-your-vintage-fiestaware/ss-AAHwLyA?ocid=chopendata	[{"Label": "Fiesta (dinnerware)", "Type": "U", "WikidataId": "Q5447308", "Confidence": 1.0, "OccurrenceOffsets": [46], "SurfaceForms": ["Fiestaware"]}, {"Label": "Need to Know (TV program)", "Type": "N", "WikidataId": "Q6986519", "Confidence": 0.917, "OccurrenceOffsets": [14], "SurfaceForms": ["Need to Know"]}]	[{"Label": "United States", "Type": "G", "WikidataId": "Q30", "Confidence": 0.924, "OccurrenceOffsets": [30], "SurfaceForms": ["America"]}]
N10087	movies	movievideo	Trailer - Full Count	Official Trailer	https://www.msn.com/en-us/movies/movievideo/trailer---full-count/vi-AAHMQU1?ocid=chopendata	[{"Label": "Count (baseball)", "Type": "C", "WikidataId": "Q5176635", "Confidence": 1.0, "OccurrenceOffsets": [10], "SurfaceForms": ["Full Count"]}]	[]
N23354	lifestyle	voices	I Used to Be Ashamed of My Heritage, Until I Realized It's the Most Beautiful Thing I Have	My friends in the United States recognize me as Latina, but to my friends in the Dominican Republic, I'm always La Gringa.	https://www.msn.com/en-us/lifestyle/voices/i-used-to-be-ashamed-of-my-heritage,-until-i-realized-it's-the-most-beautiful-thing-i-have/ar-AAIfsmF?ocid=chopendata	[]	[{"Label": "Latino", "Type": "U", "WikidataId": "Q1464994", "Confidence": 0.998, "OccurrenceOffsets": [48], "SurfaceForms": ["Latina"]}, {"Label": "Dominican Republic", "Type": "G", "WikidataId": "Q786", "Confidence": 0.999, "OccurrenceOffsets": [81], "SurfaceForms": ["Dominican Republic"]}, {"Label": "United States", "Type": "G", "WikidataId": "Q30", "Confidence": 0.986, "OccurrenceOffsets": [18], "SurfaceForms": ["United States"]}]
N23673	video	lifestyle	Inside the biggest legal marijuana factory in the United States	"We've been called that before, the Willy Wonka of weed." 60 Minutes checks out a pot processing plant holding "tens of thousands" of pounds of legal weed, Sunday at 7:30 p.m. ET and 7 p.m. PT	https://www.msn.com/en-us/video/lifestyle/inside-the-biggest-legal-marijuana-factory-in-the-united-states/vi-AAJfWfM?ocid=chopendata	[{"Label": "United States", "Type": "G", "WikidataId": "Q30", "Confidence": 0.999, "OccurrenceOffsets": [50], "SurfaceForms": ["United States"]}]	[{"Label": "Willy Wonka", "Type": "R", "WikidataId": "Q738747", "Confidence": 0.999, "OccurrenceOffsets": [36], "SurfaceForms": ["Willy Wonka"]}]
N2535	movies	movievideo	Trailer - Polaroid	Official Trailer	https://www.msn.com/en-us/movies/movievideo/trailer---polaroid/vi-AAHBznt?ocid=chopendata	[]	[]
N19183	finance	markets	Trump blasts Fed as policymakers meet on rates	Trump blasts Fed as policymakers meet on rates	https://www.msn.com/en-us/finance/markets/trump-blasts-fed-as-policymakers-meet-on-rates/ar-AAJwuHO?ocid=chopendata	[{"Label": "Donald Trump", "Type": "P", "WikidataId": "Q22686", "Confidence": 0.982, "OccurrenceOffsets": [0], "SurfaceForms": ["Trump"]}]	[{"Label": "Donald Trump", "Type": "P", "WikidataId": "Q22686", "Confidence": 0.982, "OccurrenceOffsets": [0], "SurfaceForms": ["Trump"]}]
N17125	movies	movievideo	Trailer - Bombshell	Trailer 2	https://www.msn.com/en-us/movies/movievideo/trailer---bombshell/vi-AAISJw9?ocid=chopendata	[]	[]
N5814	finance	finance-retirement	3 Social Security mistakes that could cost you a fortune	Your choices influence the size of your Social Security checks. Making these mistakes could accidentally shrink them.	https://www.msn.com/en-us/finance/finance-retirement/3-social-security-mistakes-that-could-cost-you-a-fortune/ar-AAImz24?ocid=chopendata	[{"Label": "Social Security (United States)", "Type": "U", "WikidataId": "Q13479957", "Confidence": 0.997, "OccurrenceOffsets": [2], "SurfaceForms": ["Social Security"]}]	[{"Label": "Social Security (United States)", "Type": "U", "WikidataId": "Q13479957", "Confidence": 0.997, "OccurrenceOffsets": [40], "SurfaceForms": ["Social Security"]}]
N3704	sports	football_ncaa	LSU surging, Big Ten reckoning and more we learned from college football's 'Separation Saturday'	It was a telling week of college football, one that sets up these major storylines in the back half of the season:	https://www.msn.com/en-us/sports/football_ncaa/lsu-surging,-big-ten-reckoning-and-more-we-learned-from-college-football's-'separation-saturday'/ar-AAIIKiz?ocid=chopendata	[{"Label": "LSU Tigers football", "Type": "F", "WikidataId": "Q6460028", "Confidence": 0.972, "OccurrenceOffsets": [0], "SurfaceForms": ["LSU"]}, {"Label": "Big Ten Conference", "Type": "O", "WikidataId": "Q729478", "Confidence": 1.0, "OccurrenceOffsets": [13], "SurfaceForms": ["Big Ten"]}]	[]
